{
 "schemaVersion": 1,
 "id": "be-at-one",
 "name": "Be At One",
 "cuisine": "Cocktail bar",
 "builderType": "standard",
 "aliases": [
  "be at one",
  "beatone",
  "be-at-one"
 ],
 "sample": false,
 "source": {
  "title": "Be At One Allergen & Nutritional Data: Bar Snacks (March 2026), Drinks Menu (March 2026) and Cocktail Week (October 2026)",
  "url": "https://menus.tenkites.com/beatone",
  "checkedOn": "2026-10-06"
 },
 "note": "Only items with calories, protein, carbs and fat all printed are included: the bar snacks and the non-alcoholic drinks. Be At One prints no macros for its alcoholic cocktails, wine or beer, nor a total for items with a choice (dips, fruit).",
 "categories": [
  "Bar snacks",
  "Sweet treats",
  "Alcohol-free cocktails",
  "Alcohol-free beer",
  "Non-alcoholic cocktails"
 ],
 "components": [],
 "items": [
  {
   "id": "mixed-rice-crackers-and-coated-nuts",
   "name": "Mixed Rice Crackers & Coated Nuts",
   "category": "Bar snacks",
   "serving": "",
   "nutrients": {
    "calories": 509,
    "protein": 18,
    "carbs": 41,
    "fat": 29,
    "saturatedFat": 3.7,
    "sugar": 3.6,
    "salt": 0.9
   },
   "tags": [],
   "limitedTime": false,
   "rankable": false,
   "components": [],
   "modifiers": []
  },
  {
   "id": "basil-and-garlic-green-olives",
   "name": "Basil & Garlic Green Olives",
   "category": "Bar snacks",
   "serving": "",
   "nutrients": {
    "calories": 235,
    "protein": 1,
    "carbs": 1,
    "fat": 25,
    "saturatedFat": 3,
    "sugar": 0,
    "salt": 4.2
   },
   "tags": [
    "vegetarian"
   ],
   "limitedTime": false,
   "rankable": false,
   "components": [],
   "modifiers": []
  },
  {
   "id": "salted-caramel-popcorn",
   "name": "Salted Caramel Popcorn",
   "category": "Bar snacks",
   "serving": "",
   "nutrients": {
    "calories": 132,
    "protein": 1.8,
    "carbs": 15.4,
    "fat": 6.3,
    "saturatedFat": 0.5,
    "sugar": 3.7,
    "salt": 0.2
   },
   "tags": [],
   "limitedTime": false,
   "rankable": false,
   "components": [],
   "modifiers": []
  },
  {
   "id": "lightly-sea-salted-popcorn",
   "name": "Lightly Sea Salted Popcorn",
   "category": "Bar snacks",
   "serving": "",
   "nutrients": {
    "calories": 88,
    "protein": 1.7,
    "carbs": 11.3,
    "fat": 3.5,
    "saturatedFat": 0.3,
    "sugar": 0.1,
    "salt": 0.8
   },
   "tags": [],
   "limitedTime": false,
   "rankable": false,
   "components": [],
   "modifiers": []
  },
  {
   "id": "double-chocolate-brownie-and-marshmallows",
   "name": "Double Chocolate Brownie & Marshmallows",
   "category": "Sweet treats",
   "serving": "",
   "nutrients": {
    "calories": 320,
    "protein": 3.7,
    "carbs": 44.1,
    "fat": 13.5,
    "saturatedFat": 2.2,
    "sugar": 25.7,
    "salt": 0.5
   },
   "tags": [],
   "limitedTime": false,
   "rankable": false,
   "components": [],
   "modifiers": []
  },
  {
   "id": "sweet-treats",
   "name": "Sweet Treats",
   "category": "Sweet treats",
   "serving": "",
   "nutrients": {
    "calories": 786,
    "protein": 7.4,
    "carbs": 182.1,
    "fat": 2.8,
    "saturatedFat": 1.4,
    "sugar": 143.6,
    "salt": 0.1
   },
   "tags": [],
   "limitedTime": false,
   "rankable": false,
   "components": [],
   "modifiers": []
  },
  {
   "id": "cucumber-caipirinha-0",
   "name": "Cucumber Caipirinha 0%",
   "category": "Alcohol-free cocktails",
   "serving": "",
   "nutrients": {
    "calories": 83,
    "protein": 0.9,
    "carbs": 17.9,
    "fat": 0.2,
    "saturatedFat": 0.1,
    "sugar": 14.6,
    "salt": 0
   },
   "tags": [],
   "limitedTime": false,
   "rankable": false,
   "components": [],
   "modifiers": []
  },
  {
   "id": "bit-of-me-0",
   "name": "Bit Of Me 0%",
   "category": "Alcohol-free cocktails",
   "serving": "",
   "nutrients": {
    "calories": 98,
    "protein": 0.5,
    "carbs": 21.7,
    "fat": 0,
    "saturatedFat": 0,
    "sugar": 21.7,
    "salt": 0
   },
   "tags": [],
   "limitedTime": false,
   "rankable": false,
   "components": [],
   "modifiers": []
  },
  {
   "id": "verdita-margarita-0",
   "name": "Verdita Margarita 0%",
   "category": "Alcohol-free cocktails",
   "serving": "",
   "nutrients": {
    "calories": 90,
    "protein": 0.6,
    "carbs": 20.5,
    "fat": 0.3,
    "saturatedFat": 0.1,
    "sugar": 20.4,
    "salt": 2.5
   },
   "tags": [],
   "limitedTime": false,
   "rankable": false,
   "components": [],
   "modifiers": []
  },
  {
   "id": "cucumber-tom-collins-0",
   "name": "Cucumber Tom Collins 0%",
   "category": "Alcohol-free cocktails",
   "serving": "",
   "nutrients": {
    "calories": 140,
    "protein": 0.8,
    "carbs": 27.8,
    "fat": 0.3,
    "saturatedFat": 0.1,
    "sugar": 27.8,
    "salt": 0.1
   },
   "tags": [],
   "limitedTime": false,
   "rankable": false,
   "components": [],
   "modifiers": []
  },
  {
   "id": "raspberry-tom-collins-0",
   "name": "Raspberry Tom Collins 0%",
   "category": "Alcohol-free cocktails",
   "serving": "",
   "nutrients": {
    "calories": 95,
    "protein": 0.5,
    "carbs": 19.4,
    "fat": 0.4,
    "saturatedFat": 0,
    "sugar": 19.4,
    "salt": 0.1
   },
   "tags": [],
   "limitedTime": false,
   "rankable": false,
   "components": [],
   "modifiers": []
  },
  {
   "id": "peach-tom-collins-0",
   "name": "Peach Tom Collins 0%",
   "category": "Alcohol-free cocktails",
   "serving": "",
   "nutrients": {
    "calories": 121,
    "protein": 0.5,
    "carbs": 25.3,
    "fat": 0.2,
    "saturatedFat": 0.1,
    "sugar": 27.4,
    "salt": 0.1
   },
   "tags": [],
   "limitedTime": false,
   "rankable": false,
   "components": [],
   "modifiers": []
  },
  {
   "id": "margarita-0",
   "name": "Margarita 0%",
   "category": "Alcohol-free cocktails",
   "serving": "",
   "nutrients": {
    "calories": 28,
    "protein": 0,
    "carbs": 6.2,
    "fat": 0,
    "saturatedFat": 0,
    "sugar": 6.2,
    "salt": 3
   },
   "tags": [],
   "limitedTime": false,
   "rankable": false,
   "components": [],
   "modifiers": []
  },
  {
   "id": "peroni-nastro-azzurro-0-0",
   "name": "Peroni Nastro Azzurro 0.0%",
   "category": "Alcohol-free beer",
   "serving": "330ml",
   "nutrients": {
    "calories": 76,
    "protein": 0.7,
    "carbs": 18.5,
    "fat": 0,
    "saturatedFat": 0,
    "sugar": 2.6,
    "salt": 0
   },
   "tags": [],
   "limitedTime": false,
   "rankable": false,
   "components": [],
   "modifiers": []
  },
  {
   "id": "heineken-0-0",
   "name": "Heineken 0.0%",
   "category": "Alcohol-free beer",
   "serving": "330ml",
   "nutrients": {
    "calories": 69,
    "protein": 1.3,
    "carbs": 15.8,
    "fat": 0,
    "saturatedFat": 0,
    "sugar": 4.3,
    "salt": 0
   },
   "tags": [],
   "limitedTime": false,
   "rankable": false,
   "components": [],
   "modifiers": []
  },
  {
   "id": "guinness-0-0",
   "name": "Guinness 0.0%",
   "category": "Alcohol-free beer",
   "serving": "538ml",
   "nutrients": {
    "calories": 91,
    "protein": 1.6,
    "carbs": 20.4,
    "fat": 0,
    "saturatedFat": 0,
    "sugar": 3.8,
    "salt": 0
   },
   "tags": [],
   "limitedTime": false,
   "rankable": false,
   "components": [],
   "modifiers": []
  },
  {
   "id": "corona-cero-0",
   "name": "Corona Cero 0%",
   "category": "Alcohol-free beer",
   "serving": "330ml",
   "nutrients": {
    "calories": 56,
    "protein": 1.3,
    "carbs": 12.9,
    "fat": 0,
    "saturatedFat": 0,
    "sugar": 2.3,
    "salt": 0
   },
   "tags": [],
   "limitedTime": false,
   "rankable": false,
   "components": [],
   "modifiers": []
  },
  {
   "id": "garden-margarita-0",
   "name": "Garden Margarita 0%",
   "category": "Non-alcoholic cocktails",
   "serving": "",
   "nutrients": {
    "calories": 43,
    "protein": 0.1,
    "carbs": 10,
    "fat": 0,
    "saturatedFat": 0,
    "sugar": 10,
    "salt": 0
   },
   "tags": [],
   "limitedTime": true,
   "rankable": false,
   "components": [],
   "modifiers": []
  },
  {
   "id": "english-garden-midori-sour-0",
   "name": "English Garden Midori Sour 0%",
   "category": "Non-alcoholic cocktails",
   "serving": "",
   "nutrients": {
    "calories": 55,
    "protein": 0.4,
    "carbs": 11.2,
    "fat": 0.1,
    "saturatedFat": 0,
    "sugar": 10.8,
    "salt": 0
   },
   "tags": [],
   "limitedTime": true,
   "rankable": false,
   "components": [],
   "modifiers": []
  },
  {
   "id": "lemon-drop-martini-0",
   "name": "Lemon Drop Martini 0%",
   "category": "Non-alcoholic cocktails",
   "serving": "",
   "nutrients": {
    "calories": 72,
    "protein": 0,
    "carbs": 17.3,
    "fat": 0,
    "saturatedFat": 0,
    "sugar": 17,
    "salt": 0
   },
   "tags": [],
   "limitedTime": true,
   "rankable": false,
   "components": [],
   "modifiers": []
  },
  {
   "id": "rhubarb-and-strawberry-cosmo-0",
   "name": "Rhubarb & Strawberry Cosmo 0%",
   "category": "Non-alcoholic cocktails",
   "serving": "",
   "nutrients": {
    "calories": 31,
    "protein": 0.1,
    "carbs": 6.9,
    "fat": 0,
    "saturatedFat": 0,
    "sugar": 6.9,
    "salt": 0
   },
   "tags": [],
   "limitedTime": true,
   "rankable": false,
   "components": [],
   "modifiers": []
  },
  {
   "id": "rhubarb-hugo-0",
   "name": "Rhubarb Hugo 0%",
   "category": "Non-alcoholic cocktails",
   "serving": "",
   "nutrients": {
    "calories": 59,
    "protein": 0.3,
    "carbs": 13.5,
    "fat": 0,
    "saturatedFat": 0,
    "sugar": 13.3,
    "salt": 0
   },
   "tags": [],
   "limitedTime": true,
   "rankable": false,
   "components": [],
   "modifiers": []
  },
  {
   "id": "rhubarb-hugo-0-pm",
   "name": "Rhubarb Hugo 0% - PM",
   "category": "Non-alcoholic cocktails",
   "serving": "",
   "nutrients": {
    "calories": 59,
    "protein": 0.3,
    "carbs": 13.5,
    "fat": 0,
    "saturatedFat": 0,
    "sugar": 13.3,
    "salt": 0
   },
   "tags": [],
   "limitedTime": true,
   "rankable": false,
   "components": [],
   "modifiers": []
  }
 ],
 "combinations": []
}
